[
	{
		"id": 1,
		"name": "Austin Glander",
		"image": "/images/leadership/AustinGlander.avif",
		"major": "CPSC",
		"year": 2027,
		"socials": {
			"email": "austinglander@tamu.edu",
			"github": "https://github.com/austinglander",
			"linkedin": "https://www.linkedin.com/in/austinglander"
		},
		"roles": [
			{
				"title": "President",
				"section": "officers"
			},
			{
				"title": "Cisco Networking Academy Student Ambassador",
				"section": "Cisco"
			}
		]
	},
	{
		"id": 2,
		"name": "Preston VanderLight",
		"image": "/images/leadership/PrestonVanderLight.avif",
		"major": "ECEN",
		"year": 2027,
		"socials": {
			"email": "preston.vanderlight@tamu.edu",
			"linkedin": "https://www.linkedin.com/in/prestonvanderlight/"
		},
		"roles": [
			{
				"title": "Vice President",
				"section": "officers"
			}
		]
	},
	{
		"id": 3,
		"name": "Vincent Dang",
		"image": "/images/leadership/VincentDang.webp",
		"major": "ENGR",
		"year": 2029,
		"socials": {
			"email": "vincent.dang@tamu.edu",
			"linkedin": "https://www.linkedin.com/in/vincent-dang-6a812727a/"
		},
		"imageMode": "icon",
		"roles": [
			{
				"title": "Treasurer",
				"section": "officers"
			}
		]
	},
	{
		"id": 4,
		"name": "Jason Lau",
		"image": "/images/leadership/JasonLau.webp",
		"major": "CSCE",
		"year": 2027,
		"socials": {
			"email": "jasonylau@tamu.edu",
			"github": "https://github.com/jasonlau05",
			"linkedin": "https://www.linkedin.com/in/jasonlau0/",
			"website": "https://people.tamu.edu/~jasonylau/"
		},
		"imageMode": "icon",
		"roles": [
			{
				"title": "Director of Public Relations",
				"section": "officers"
			}
		]
	},
	{
		"id": 5,
		"name": "Zach Smith",
		"image": "/images/leadership/ZachSmith.avif",
		"major": "CPSC",
		"year": 2027,
		"socials": {
			"email": "zts493@tamu.edu",
			"github": "https://github.com/wackooswami",
			"linkedin": "https://www.linkedin.com/in/zachary-smith2027"
		},
		"roles": [
			{
				"title": "Director of External Relations",
				"section": "officers"
			}
		]
	},
	{
		"id": 6,
		"name": "Alex Eade",
		"image": "/images/leadership/AlexEade.avif",
		"major": "MISY",
		"year": 2026,
		"socials": {
			"email": "alexandereade@tamu.edu",
			"linkedin": "https://www.linkedin.com/in/alexandereade/"
		},
		"roles": [
			{
				"title": "Director of Activity Groups",
				"section": "officers"
			}
		]
	},
	{
		"id": 7,
		"name": "Alex Zhang",
		"image": "/images/leadership/AlexZhang.avif",
		"major": "CPSC",
		"year": 2027,
		"socials": {
			"email": "alexzhang05@tamu.edu",
			"github": "https://github.com/flocto",
			"website": "https://flocto.github.io/"
		},
		"roles": [
			{
				"title": "Director of Competitions",
				"section": "officers"
			},
			{
				"title": "Cyber Operations (CTF)",
				"section": "Cyber Operations"
			}
		]
	},
	{
		"id": 8,
		"name": "Kevin Guerra",
		"image": "/images/leadership/KevinGuerra.avif",
		"major": "ENGR",
		"year": 2028,
		"socials": {
			"email": "kevin.guerra.v@tamu.edu",
			"linkedin": "https://www.linkedin.com/in/kevin-guerra-v/"
		},
		"roles": [
			{
				"title": "Red Hat Academy Student Ambassador",
				"section": "Red Hat"
			}
		]
	},
	{
		"id": 9,
		"name": "Owen Shadburne",
		"image": "/images/leadership/OwenShadburne.avif",
		"major": "CPSC",
		"year": 2027,
		"socials": {
			"email": "shadbowne@tamu.edu",
			"linkedin": "https://www.linkedin.com/in/owen-shadburne/",
			"github": "https://github.com/CubeTures"
		},
		"roles": [
			{
				"title": "Director of Technology",
				"section": "officers"
			},
			{
				"title": "Red Hat Academy Student Ambassador",
				"section": "Red Hat"
			}
		]
	},
	{
		"id": 10,
		"name": "Martin Carlisle",
		"image": "/images/leadership/MartinCarlisle.jpg",
		"major": "CSCE Department",
		"socials": {
			"linkedin": "https://www.linkedin.com/in/martincarlisle/",
			"website": "https://martincarlisle.com/"
		},
		"imageMode": "icon",
		"roles": [
			{
				"title": "Faculty Advisor",
				"section": "officers"
			}
		]
	},
	{
		"id": 11,
		"name": "Sam Bederman",
		"image": "/images/leadership/SamBederman.webp",
		"major": "CSCE",
		"year": 2027,
		"socials": {
			"email": "beds@tamu.edu",
			"linkedin": "https://www.linkedin.com/in/sam-bederman/"
		},
		"imageMode": "icon",
		"roles": [
			{
				"title": "Cyber Operations (Malware)",
				"section": "Cyber Operations"
			}
		]
	},
	{
		"id": 12,
		"name": "Michael Bengil",
		"image": "/images/leadership/MichaelBengil.webp",
		"major": "CSCE",
		"year": 2027,
		"socials": {
			"email": "mace.bengil@tamu.edu",
			"linkedin": "https://www.linkedin.com/in/michael-ace-bengil-83a535212/",
			"website": "https://archan6el.github.io/"
		},
		"imageMode": "icon",
		"roles": [
			{
				"title": "Cyber Operations (Pentesting)",
				"section": "Cyber Operations"
			}
		]
	},
	{
		"id": 13,
		"name": "David Corvaglia",
		"image": "/images/leadership/DavidCorvaglia.webp",
		"major": "CPCS",
		"year": 2028,
		"socials": {
			"email": "corvaglia@tamu.edu",
			"website": "https://corvaglia.dev"
		},
		"imageMode": "icon",
		"roles": [
			{
				"title": "Hardware Hacking Lead",
				"section": "Hardware Hacking"
			}
		]
	},
	{
		"id": 14,
		"name": "Kalyan Adhikari",
		"image": "/images/leadership/KalyanAdhikari.avif",
		"major": "GIST",
		"year": 2027,
		"socials": {
			"email": "kalyanadhikari@tamu.edu"
		},
		"roles": [
			{
				"title": "Palo Alto Academy Student Ambassador",
				"section": "Palo Alto"
			}
		]
	},
	{
		"id": 15,
		"name": "Luke Laudeman",
		"image": "/images/leadership/LukeLaudeman.webp",
		"major": "INTA",
		"year": 2027,
		"socials": {
			"email": "luke123@tamu.edu"
		},
		"imageMode": "icon",
		"roles": [
			{
				"title": "AWS Academy Student Ambassador",
				"section": "AWS"
			}
		]
	},
	{
		"id": 16,
		"name": "Geoffrey Bosenbark",
		"image": "/images/leadership/GeoffreyBosenbark.webp",
		"major": "INTA",
		"year": 2027,
		"socials": {
			"email": "bosenbarkgb@tamu.edu",
			"linkedin": "https://www.linkedin.com/in/geoffrey-bosenbark/"
		},
		"imageMode": "icon",
		"roles": [
			{
				"title": "Policy Lead",
				"section": "Policy"
			}
		]
	}
]
